{
  "id": "minimal-frame-quote",
  "name": "Framed Quote",
  "category": "minimal",
  "isPremium": false,
  "canvasAspectRatio": "4:5",
  "cells": [
    { "id": "hero", "type": "photo", "shape": "rectangle",
      "frame": { "x": 0.12, "y": 0.1, "width": 0.76, "height": 0.6 } },
    { "id": "quote", "type": "text", "shape": "rectangle",
      "frame": { "x": 0.1, "y": 0.76, "width": 0.8, "height": 0.14 },
      "text": "Stay Golden", "fontName": "Baskerville-BoldItalic", "fontSize": 92,
      "color": "#1A1A1C", "alignment": "center" }
  ],
  "background": { "type": "solid", "color": "#FBFAF8" }
}
