{
  "id": "seasonal-quartet",
  "name": "Quartet",
  "category": "seasonal",
  "isPremium": false,
  "canvasAspectRatio": "9:16",
  "cells": [
    { "id": "one", "type": "photo", "shape": "rectangle",
      "frame": { "x": 0.07, "y": 0.05, "width": 0.52, "height": 0.22 } },
    { "id": "two", "type": "photo", "shape": "rectangle",
      "frame": { "x": 0.41, "y": 0.29, "width": 0.52, "height": 0.22 } },
    { "id": "three", "type": "photo", "shape": "rectangle",
      "frame": { "x": 0.07, "y": 0.53, "width": 0.52, "height": 0.22 } },
    { "id": "four", "type": "photo", "shape": "rectangle",
      "frame": { "x": 0.41, "y": 0.77, "width": 0.52, "height": 0.20 } }
  ],
  "background": { "type": "solid", "color": "#FBF6EE" }
}
